codigo;nome;categoria;preco;qt;descricao;marca;promocao;imagem
1888;PROCESSADOR INTEL CELERON 1151 LGA1200 G5905 4MB;Processador;214,99;23;Intel Celeron G5905 LGA1200 4MB;Intel;nao;g5905.webp
1889;PROCESSADOR INTEL CELERON 1151 LGA1200 G5925 3.6GHZ;Processador;214,99;16;Intel Celeron G5925 3.6GHz LGA1200;Intel;nao;g5925.webp
1039;PROCESSADOR INTEL I3 LGA1150 4150/4160 3.4GHZ 3MB OEM;Processador;75,90;5;Intel Core i3 4150/4160 3.4GHz 3MB OEM;Intel;nao;i34150.webp
1721;PROCESSADOR INTEL I3 LGA1151 9100F 3.6GHZ 3MB 9GER;Processador;429,90;5;Intel Core i3 9100F 3.6GHz 9ª geração;Intel;nao;i39100f.webp
1891;PROCESSADOR INTEL I3 LGA1200 10100F 3.6GHZ 6MB 10ªG;Processador;499,90;28;Intel Core i3 10100F 3.6GHz 6MB 10ª geração;Intel;sim;i310100f.webp
401960;PROCESSADOR INTEL I3 LGA1200 CORE 10105 3.70GHZ 6MB;Processador;920,00;5;Intel Core i3 10105 3.7GHz 6MB;Intel;nao;i310105.webp
1830;PROCESSADOR INTEL I5 LGA1150 4570 4ªG;Processador;199,90;10;Intel Core i5 4570 4ª geração;Intel;nao;i54570.webp
1831;PROCESSADOR INTEL I5 LGA1151 8400 OEM;Processador;672,00;1;Intel Core i5 8400 OEM;Intel;nao;i58400.webp
1722;PROCESSADOR INTEL I5 LGA1151 9400F OEM;Processador;590,00;5;Intel Core i5 9400F OEM;Intel;nao;i59400f.webp
1719;PROCESSADOR INTEL I5 LGA1155 3570 3.8GHZ 6MB OEM;Processador;175,90;21;Intel Core i5 3570 3.8GHz 6MB OEM;Intel;sim;i53570.webp
1638;PROCESSADOR INTEL I5 LGA1155 3470 3.2GHZ OEM;Processador;179,90;1;Intel Core i5 3470 3.2GHz OEM;Intel;nao;i53470.webp
402467;PROCESSADOR INTEL I5 LGA1200 11400F 2.6 GHZ 12MB 11ª;Processador;1040,00;1;Intel Core i5 11400F 2.6GHz 12MB 11ª geração;Intel;nao;i511400f.webp
1774;PROCESSADOR INTEL I5 LGA1700 12400F 4.4 GHZ 12MB;Processador;905,00;3;Intel Core i5 12400F LGA1700 12ª geração;Intel;sim;i512400f.webp
1042;PROCESSADOR INTEL I5 13400 LGA1700;Processador;1634,00;2;Intel Core i5 13400 2.5GHz 20MB 13ª geração;Intel;nao;i513400.webp
1890;PROCESSADOR INTEL I5 14400 LGA1700;Processador;1699,00;3;Intel Core i5 14400 14ª geração;Intel;nao;i514400.webp
402614;PROCESSADOR INTEL I7 3770 LGA1155;Processador;432,45;1;Intel Core i7 3770 3.9GHz;Intel;nao;i73770.webp
1890;PROCESSADOR INTEL PENTIUM G5400T;Processador;399,00;4;Intel Pentium G5400T 3.1GHz;Intel;nao;g5400t.webp
1828;NVIDIA PLACA DE VIDEO INNO3D RTX3060 12GB DDR6;Placa de vídeo;2185,50;1;RTX 3060 12GB DDR6 PCIe 4.0;NVIDIA;nao;rtx3060.webp
402487;NVIDIA PLACA DE VIDEO GTX 550 1GB DDR5 128 BITS;Placa de vídeo;303,18;1;GTX 550 1GB DDR5 128 bits;NVIDIA;sim;gtx550.webp
1572;NVIDIA PLACA DE VIDEO GT740 2GB DDR3 BLUECASE;Placa de vídeo;337,59;1;GT740 2GB DDR3 128 bits BlueCase;NVIDIA;sim;gt740.webp
1571;NVIDIA PLACA DE VIDEO GT710 2GB DDR3 HOOPSON;Placa de vídeo;404,55;6;GT710 2GB DDR3 64 bits Hoopson;NVIDIA;sim;gt710.webp
401640;AMD PLACA DE VIDEO R5 230 2GB DDR3 PCYES;Placa de vídeo;223,20;2;Radeon R5 230 2GB DDR3 64 bits PCYes;AMD;sim;r5230.webp
1046;AMD PLACA DE VIDEO RX570 8GB DDR5 PCYES;Placa de vídeo;804,08;2;RX570 8GB DDR5 256 bits PCYes;AMD;sim;rx570.webp
1899;NVIDIA PLACA DE VIDEO GTX1050 4GB DDR5 GALAX;Placa de vídeo;1013,70;2;GTX 1050 4GB DDR5 128 bits Galax;NVIDIA;nao;gtx1050.webp
402270;NVIDIA PLACA DE VIDEO GTX1050 TI 4GB DDR5 ASUS;Placa de vídeo;1329,90;1;GTX 1050 Ti 4GB DDR5 128 bits ASUS;NVIDIA;nao;gtx1050ti.webp
401807;NVIDIA PLACA DE VIDEO GTX1660 6GB DDR5 GALAX;Placa de vídeo;1534,50;1;GTX 1660 6GB DDR5 192 bits Galax;NVIDIA;sim;gtx1660.webp
401583;PLACA MAE ASUS 1151 8ª/9ªG H310M-E PRIME DHMI DDR4;Placa mãe;649,90;1;Placa mãe Asus H310M-E Prime HDMI DDR4 socket 1151 8ª/9ª geração;Asus;nao;h310meprime.webp
1773;PLACA MAE ASUS H610M-CS D4 PRIME 12ª GER;Placa mãe;699,90;1;Placa mãe Asus H610M-CS D4 Prime socket 1700 12ª geração;Asus;nao;h610mcsprime.webp
1041;PLACA MAE ASUS H610M-K D4 PRIME 12ª GER;Placa mãe;699,90;1;Placa mãe Asus H610M-K D4 Prime socket 1700 12ª geração;Asus;nao;h610mkprime.webp
1833;PLACA MAE BRASIL PC S1150 H81 BPCH81M;Placa mãe;209,99;1;Placa mãe Brasil PC H81 BPCH81M socket 1150;Brasil PC;nao;bpch81m.webp
1829;PLACA MAE BRAZIL PC 1155 DDR3 BPC-H61-ITX-M.2;Placa mãe;159,99;1;Placa mãe Brazil PC H61 ITX M.2 DDR3 socket 1155;Brazil PC;nao;bpc-h61-itx.webp
401513;PLACA MAE GIGABYTE 1151 8ª/9ªG H310M-H DDR4;Placa mãe;649,90;1;Placa mãe Gigabyte H310M-H DDR4 socket 1151 8ª/9ª geração;Gigabyte;nao;h310mh.webp
1525;PLACA MAE GIGABYTE H610M-K 1700 HDMI ATX;Placa mãe;665,00;1;Placa mãe Gigabyte H610M-K HDMI ATX socket 1700;Gigabyte;nao;h610mk.webp
1565;PLACA MAE HAYOM 1155 B75M S/S/V/R DDR3 PLM2301;Placa mãe;160,00;1;Placa mãe Hayom B75M DDR3 PLM2301 socket 1155;Hayom;nao;plm2301.webp
1564;PLACA MAE HAYOM 1155 H61M EL DDR3 PLM2300;Placa mãe;160,00;1;Placa mãe Hayom H61M EL DDR3 PLM2300 socket 1155;Hayom;sim;plm2300.webp
401778;PLACA MAE PCWARE 1151 8ª/9ªG IPMB360 PRO-GAMING DDR4;Placa mãe;530,00;1;Placa mãe PCWare IPMB360 PRO-GAMING DDR4 socket 1151 8ª/9ª geração;PCWare;nao;ipmb360.webp
402176;PLACA MAE PCWARE 1151 8ª/9ªG IPMH310G DDR4;Placa mãe;530,00;1;Placa mãe PCWare IPMH310G DDR4 socket 1151 8ª/9ª geração;PCWare;nao;ipmh310g.webp
401721;PLACA MAE PCWARE 1151 8ª/9ªG IPMH310G DDR4 PRO;Placa mãe;470,00;1;Placa mãe PCWare IPMH310G DDR4 PRO socket 1151 8ª/9ª geração;PCWare;nao;ipmh310gpro.webp
